battery,biological,cardboard,clothes,glasses,metal,paper,plastic,shoes,trash
"Punya baterai bekas? Jangan dibuang ke tempat sampah biasa ya! Bahan beracunnya bisa mencemari air. Yuk, kumpulkan dan kirim ke pengelola sampah B3.,Punya sampah sisa makanan? Yuk mulai membuat kompos untuk menyuburkan tanah sekitar rumah!,""Sebelum buang kardus bekas, lipat dulu yuk biar hemat tempat dan lebih mudah diolah ulang!"",""Punya pakaian yang sudah jarang dipakai? Yuk, sumbangkan ke yayasan amal dan jadikan mereka bermanfaat bagi yang membutuhkan!"",Punya botol kaca kosong di rumah? Jangan langsung dibuang! Sulap jadi dekorasi rumah yang cantik dan estetik.,""Hai, punya kaleng bekas? Yuk, gunakan tempat daur ulang untuk minuman atau makanan kaleng!"",""Hai, jangan buru-buru buang kertas, ya! Gunakan kedua sisinya dulu supaya lebih hemat."",""Hai, kalau pilih plastik, cari yang punya tanda daur ulang #1 atau #2, ya. Lebih mudah didaur ulang, loh!"",""Hai, punya sepatu layak pakai? Donasikan ke organisasi amal, yuk!"",Harap gunakan kantong sampah khusus untuk limbah berbahaya."
"Tahukah kamu? Banyak toko elektronik punya program daur ulang baterai. Cek di sekitar rumahmu dan manfaatkan program ini!,""Mau cara praktis buang sampah organik? Gunakan alat penghancur sampah organik, lebih mudah dan ramah lingkungan!"",""Jangan buang kardus yang basah ke tempat daur ulang ya, karena kardus basah sulit untuk didaur ulang dengan baik."",Kreatif dengan kain bekas? Kamu bisa ubah jadi kain lap atau kerajinan unik buatanmu sendiri.,""Hati-hati ya, jangan pecahkan kaca sebelum dibuang karena bisa berbahaya untukmu dan orang lain!"",""Eits, hati-hati! Jangan buang kaleng berkarat di tempat sampah biasa. Berbahaya banget, loh!"",""Yuk, hemat ruang! Lipat atau potong kertas jadi kecil sebelum dibuang. Praktis banget, kan?"",""Yuk, mulai kebiasaan baru! Hindari plastik sekali pakai dan pakai wadah isi ulang yang lebih ramah lingkungan."",""Kreatif, dong! Gunakan kembali sepatu tua kamu untuk proyek seni seru."",Sampah berbahaya jangan dibuang tanpa dikemas dengan aman ya."
"Mau hemat dan ramah lingkungan? Gunakan baterai isi ulang, yuk! Selain lebih awet, kamu juga mengurangi limbah.,""Jangan buang tulang atau lemak ke saluran air, ya! Selain bikin mampet, itu juga bisa bikin masalah besar di rumah."",Kreatif dengan kardus bekas? Kamu bisa ubah jadi kerajinan tangan seperti kotak penyimpanan atau organizer. Seru banget!,""Punya pakaian yang sudah rusak? Jangan dibuang sembarangan, pilah dan kirimkan untuk didaur ulang jadi tekstil baru."",""Yuk, bantu daur ulang kaca dengan memisahkan antara yang bening dan berwarna agar lebih mudah diolah."",""Kaleng bekasmu mau didaur ulang? Pastikan bersih dulu, ya, biar prosesnya lancar."",""Psst... tahu nggak? Kertas berminyak lebih baik dikomposkan kalau bisa, jangan langsung dibuang!"",""Eits, jangan lupa! Cuci bersih botol plastik sebelum dibuang supaya bisa didaur ulang dengan baik."",""Ups, jangan buang sepatu bareng sampah organik, ya. Yuk, pilah dengan bijak!"",""Hai, kamu bisa pisahkan limbah berbahaya untuk penanganan khusus."""
"Punya baterai bekas di rumah? Simpan dalam kardus kecil dulu sebelum dikirim ke tempat pengelolaan limbah B3. Praktis banget!,""Sebelum membuang sampah, pisahkan terlebih dahulu sampah organic dan anorganik agar lebih mudah untuk didaur ulang."",Punya kardus bekas menumpuk? Donasikan aja ke pusat pengemasan lokal biar bisa diolah kembali jadi kemasan baru.,""Ingat, pakaian bekas bukan untuk tempat sampah biasa! Cari cara agar limbah tekstilmu tidak mencemari lingkungan."",""Punya botol kaca unik? Donasikan ke pengrajin lokal, siapa tahu jadi karya seni yang keren."",Tips nih! Lepaskan tutup kaleng sebelum dibuang supaya lebih mudah diolah.,""Jadi kreatif, yuk! Gunakan kertas bekas untuk kerajinan tangan atau sebagai catatan."",""Ups, jangan campur plastik dengan limbah organik, ya. Pilah sesuai kategorinya!"",""Cari tahu, deh! Ada banyak program pengumpulan sepatu di toko atau komunitas lokal."",Edukasi anak-anak tentang pentingnya memilah sampah."
"Jangan pernah membakar baterai! Selain berbahaya untuk lingkungan, asapnya juga bisa beracun, lho.,""Awas, jangan campur limbah organik dengan bahan beracun. Karena kita harus menjaga keamanan lingkungan!"",""Sebelum daur ulang, cek dulu kardusmu ya! Pastikan tidak ada sisa makanan agar proses daur ulangnya lebih maksimal."",""Baju bolong atau jahitan lepas? Coba perbaiki dulu, siapa tahu bisa dipakai lagi dan tetap kece!"",Botol kaca bekas ternyata bisa jadi wadah penyimpanan minuman lho. Hemat sekaligus ramah lingkungan!,Jangan buang sia-sia! Gunakan kembali kaleng untuk proyek kerajinan atau jadi pot bunga unik.,""Eits, jangan campur kertas dengan plastik saat membuang, ya. Pisahkan supaya lebih mudah didaur ulang!"",""Kreatif, deh! Gunakan kembali botol plastik sebagai tempat penyimpanan untuk barang-barang kecil."",""Seru banget, loh! Sol sepatu bisa didaur ulang jadi bahan playground. Kamu bisa cek program daur ulang di sekitar."",Gunakan tempat sampah yang ada penutupnya untuk mencegah bau menyebar ya."
"Awas, jangan campur baterai bekas dengan sampah lain. Baterai mengandung bahan berbahaya yang perlu perlakuan khusus.,Bingung dengan sisa makanan? Coba buat meal prep dan rencanakan menu harian agar bahan makanan nggak terbuang percuma.,""Mau taman cantik tanpa gulma? Gunakan kardus bekas sebagai alas taman, lalu tambahkan kerikil di atasnya untuk tampilan yang lebih estetik!"",""Lemari penuh? Manfaatkan aplikasi barter atau jual pakaian bekasmu, dapat cuan sambil decluttering!"",""Ada tempat daur ulang kaca di dekatmu? Yuk, bawa botol bekasmu ke sana dan dukung daur ulang!"",Tahukah kamu? Kaleng bekas bisa dijual ke pengepul barang bekas. Jadi lebih bermanfaat!,""Koran bekas jangan dibuang, loh! Bisa banget dijadikan pembungkus barang yang ramah lingkungan."",""Ajak keluarga juga, yuk! Edukasi mereka cara memilah plastik berdasarkan jenisnya. Seru kalau dilakukan bareng-bareng."",""Jangan buang sia-sia! Potong bagian sepatu yang masih bagus untuk dijadikan material lain. Kreatif banget, kan?"",Kamu bisa komposkan limbah organik untuk mengurangi limbah di kategori ini."
"Kalau ada baterai lithium, pisahkan ya. Salah kelola bisa berisiko meledak! Yuk, lebih hati-hati.,Ada makanan berlebih? Donasikan sebelum kedaluwarsa! Kamu bisa berbagi kebaikan sekaligus mengurangi limbah.,""Cari tempat daur ulang khusus kardus di sekitar rumahmu, yuk! Bantu lingkungan jadi lebih bersih dan hijau."",""Tahu nggak? Banyak bank pakaian lokal siap menerima pakaian bekas untuk didaur ulang. Yuk, cari yang terdekat!"",""Jangan buang kaca di tempat sampah biasa ya. Selain dapat membahayakan diri sendiri dan orang lain, sayang kalau tidak didaur ulang."",""Pisahkan, yuk! Jangan campur logam dengan limbah kaca supaya nggak mengganggu proses daur ulang."",""Coba cek di daerahmu, ada nggak program daur ulang kertas? Kalau ada, yuk ikutan!"",""Tahukah kamu? Ada tempat khusus yang menerima plastik seperti bubble wrap. Yuk, cari tahu dan kirim ke sana!"",""Punya sepatu bekas? Yuk, ubah jadi pot tanaman unik untuk hiasan rumahmu!"",Jangan lupa untuk memisahkan sampah ini dengan plastik terpisah ya."
"Mulai dari rumah! Edukasi keluarga tentang bahaya membuang baterai sembarangan. Bersama keluarga, lingkungan jadi lebih sehat!,""Simpan sampah organikmu di wadah tertutup, yuk! Selain menghindari bau, ini juga bikin rumah tetap nyaman."",""Awas, jangan campur kardus bekas dengan plastik ya, biar proses daur ulangnya lebih gampang dan efektif."",""Punya baju lama? Jadikan isian bantal DIY untuk mempercantik rumahmu, mudah dan seru!"",Ayo ajak anak-anak belajar soal bahaya pecahan kaca. Edukasi kecil ini bisa bikin mereka lebih peduli terhadap lingkungan!,""Ups, jangan pernah membakar limbah logam! Ini mencemari udara dan berbahaya bagi kesehatan."",""Kertas yang nggak bisa didaur ulang? Komposkan saja. Lingkungan juga ikut senang, nih!"",Punya plastik keras? Gunting jadi kecil dulu sebelum dibuang agar lebih aman.,""Eits, jangan buang sepatu ke tempat sampah biasa. Ada banyak cara untuk mendaur ulangnya. Yuk, cari alternatif!"",Jangan campur sampah seperti ini dengan limbah biasa ya."
"Malas keluar rumah? Gunakan layanan pengambilan limbah elektronik untuk membuang baterai dengan aman dan praktis.,""Punya lahan kecil? Ubah jadi kebun mini dengan pupuk kompos buatan sendiri. Tanah subur, tanaman tumbuh subur!"",""Bingung dengan tumpukan kertas atau buku bekas? Gunakan kardus untuk menyimpannya, rumah jadi lebih rapi deh!"",Mulai perubahan dari diri sendiri. Ajak teman-teman belajar soal fast fasion agar lebih bijak dalam membeli pakaian.,""Sebelum didaur ulang, pastikan botol kacamu bersih dulu ya biar prosesnya lebih efektif."",Ayo ajak teman-teman! Edukasi komunitasmu tentang pentingnya daur ulang logam.,""Hati-hati, ya! Pastikan dokumen penting dihancurkan dulu sebelum dibuang."",""Bijak belanja, yuk! Hindari produk yang berlebihan dalam kemasan plastik. Pilih yang lebih ramah lingkungan."",""Tahu nggak? Sepatu olahraga bekas kamu bisa bikin anak-anak lebih semangat berolahraga. Sumbangkan, yuk!"",Sampah seperti ini tidak boleh digabungkan dengan sampah lain ya."
"Sebelum membuang baterai, cek labelnya dulu. Panduan di label bisa bantu kamu membuang baterai dengan cara yang tepat.,""Jangan lupa, ajak keluarga atau tetangga untuk mulai mengelola limbah organik bersama. Lingkungan sehat, hidup lebih sehat!"",""Punya kardus bekas? Ubah jadi celengan unik atau figura lucu. Praktis, murah, dan super kreatif!"",""Suka belanja pakaian? Yuk, bijak memilih! Beli secukupnya dan kurangi limbah tekstil dari sekarang."",""Jadikan botol kaca bekas jadi pot tanaman mini. Rumah makin hijau, limbah berkurang, keren bukan?"",Kaleng bekas yang masih bagus? Gunakan saja sebagai wadah penyimpanan yang praktis.,Punya kertas bekas? Gunakan sebagai bahan pengisi kemasan. Ramah lingkungan dan tetap bermanfaat!,""Plastik bekas juga bisa bermanfaat, loh! Donasikan untuk proyek daur ulang lokal di komunitasmu."",""Biar makin bermanfaat, cuci dulu sepatumu sebelum didonasikan. Jadi, makin bernilai buat yang membutuhkan!"",""Hai, kamu bisa memisahkan sampah ini ke tempat sampah daur ulang."""
